tw;puntuacion
Hace un mes que tomaron muestras de Covid 19 en la carcel de Villavicencio las ultimas que hicieron alla a hoy no han llegado resultados o los estan ocultando No han vuelto a dar reportes de la carcel INPEC Colombia MinSaludCol harmanfelipe VillavoSalud SaludMeta;0
epssura comfenalcovalle CoomevaSaludEPS EPS Famisanar Supersalud que posibilidad hay que si una persona muere de alguna enfermedad las EPS no cremen la persona y luego le digan al familiar que murio de covid 19;0
Datos de la Unesco indican que aun el 70 de los estudiantes nivel internacional siguen afectados por el cierre de las instituciones debido a la covid 19;0
Ministro de Salud dice que Quito vive pico de atenciones por covid 19 no de contagios El Comercio Ecuador Hablemosdealgo;0
QuedateEnCasa El alto indice de contagiados de COVID 19 en Cali no es el unico problema que aqueja a la ciudad El denominado Rebrote de la violencia tiene en ascuas a las autoridades n;0
El canton Pastaza esta en semaforo amarillo y probablemente en un mes en verde y las nacionalidades indigenas siguen en rojo en el completo abandono Covid 19;0
QuedateEnCasa La radiacion solar ultravioleta UV y la densidad de poblacion afectan a los contagios de la COVID 19 segun un estudio del Hospital Clinic IDIBAPS en Barcelona n;0
NoticiasUno NoticiasRCN Noticiascaracol n BluradioCo Sen ores Periodistas de los muertos reportados por Covid 19 cuales son verdaderas Por favor investiguen a las EPS que esta pasando realmente porque hoy en dia todos los que mueren son por Covid 19 Algo huele mal;0
ATENCION Covid 19 podria propagarse aun mas en EEUU por protestas en Minneapolis n 2Jun FelizMartes Covid19 Minneapolis EEUU GeorgeFloyd;0
Extendamos la mano para ayudar no para quitar Covid 19 Caridad Amor;0
Medico de Wuhan primer fallecido por Covid 19 en China tras varias semanas;0
QuedateEnCasa Asi esta el Panorama Nacional del Covid 19 en el pais de acuerdo al ultimo informe entregado por MinSaludCol;0
Regiones De los cinco integrantes de una familia en Malambo cuatro fallecieron La madre es la unica que vive pero esta en cuidados intensivos por Covid 19 n;0
ClaudiaLopez HOLLMANMORRIS INMIGRACIONCOL venezolanos deben salir de Colombia facilitar transporte estan pagando pasaje no pueden retener violan derechos de extranjeros Que salgan sin retorno No hay mas cabida por COVID 19 Venezuela pais de origen;0
Se supone que ni los directivos de La Liga se enteraron de los positivos al interior de la escuadra cule;0
Covid19DH Prohibicion de reuniones de mas de ocho personas en Hong Kong Mas en;0
PRUDENCIA VIAJEROS PARA TOMARLO MUY EN CUENTA COVID 19 lista de los aeropuertos con mas riesgo de contagio en el Mundo;0
Fallecio el medico de Wuhan contagiado de covid 19 cuya piel se oscurecio n n;0
Alcalde de Barranquilla Jaime Pumarejo manifiesta que tiene identificados a los lideres de Siape barrio donde se negaron a realizarse los examenes del Covid 19;0
Lenin Por favor en el pais las personas aumentan contaminados y mueren por cantidades industriales por covid 19 y uds salen con estas noticias la unica explicacion es q lo hacen para q fugen las ratas escondidas de su gobierno porq el barco se les hunde;0
Cierran CamaraColombia rama judicial a media marcha asesinatos de lideres sociales todos los dias Pte IvanDuque encarretado con su labor de gerente del Covid 19 y presentador de noticias y gabinete hacen ofertas como directores Ong y entre tanto el pais se derrumba;0
A Guayaquil la estan salvando los empresarios entre ellos Baqueiba LassoGuillermo Maria Gloria Alarcon Banco de Alimentos Pero Uds no estan preparados para aceptar eso nUn ejemplo para imitar Guayaquil vencio el COVID 19;0
Asesinato de lideres sociales deforestacion destruccion de ecosistemas y en general los delitos contra TODAS las formas de vida continuan en medio del Covid 19 n nCon su firma apoye UnLlamadoPorLaVida y pidamos al Gobierno y autoridades ACCIONES YA n;0
jamacano75 Esto como consecuencia del efecto temporal que genera en la economia mundial la incertidumbre por el virus Covid 19 o comunmente llamado Coronavirus PorvenirTeResponde;0
El COVID 19 avanza en America entre la alarmante alza de casos y la rin a EE UU China;0
Jair Bolsonaro ante nuevo record de muertes por Covid 19 en Brasil Es el destino de todo el mundo;0
YoSoySora NoticiasCaracol Se reinvento Es efecto COVID 19;0
JaimeChincha Minsa Peru Estimado Jaime el distrito de Castilla Piura uno de los mas afectados a nivel nacional por el Covid 19 lleva poco menos de 48 horas sin agua potable porque EPS GRAU corto el servicio sin avisarnos previamente Ayudanos por favor denunciando este atropello contra la salud;0
Ahora ademas de cuidarme de tocar superficies y gente para evitar el Covid 19 debo evitar estar cerca de gente frotando sus guantes de latex tocando por todos lados malditos les da por tocarse hasta el culo cuando se ponen guantes de latex;0
En el allanamiento al domicilio del expresidebte Bucaram se encontraron cajas con insumos medicos alrededor de 5 000 mascarillas y 2 000 tests de pruebas rapidas para Covid 19 y una pistola con varias cajas de municiones cuya tenencia legal no pudo justificar SomosTuVozTv;0
HNO3666 eluniversocom Y las pruebas del covid 19 mascarillas y otros insumos medicos q dijo la FiscaliaEcuador DianaSalazarM2 que son igual a las q estaban en las bodegas del Hospital Teodoro Maldonado Carbo como hablamos;0
Bill Gates teme que desinformacion disuada a las personas de vacunarse contra la COVID 19;0
Los adoctrinadores de Fecode no se conforman con contagiar a los jovenes con su odio ahora tambien pretenden extender el contagio del Covid 19;0
Iran reporta 3 574 nuevos casos diarios de covid 19;0
Por emergencia del covid 19 semana laboral podra ser de cuatro dias n nA traves del decreto 770 de 2020 el Gobierno establecio una serie de medidas en materia laboral Aqui le contamos;0
ActualidadDH Fallecidos en Colombia por COVID 19 suman 1 045 Mas en;0
1 1 LaVerdad Alegacion el sistema politico chino es la raiz del problema n n Realidad Verificada el virus no distingue ideologia o sistema social El PCCh y el gobierno chino han jugado un papel decisivo al liderar al pueblo chino en la exitosa lucha contra Covid 19;0
PizarroMariaJo ColombiaHumana MovimientoMAIS Da ganas de ponerse a llorar que porque la nin eria y rebeldia sin causa de algunos representantes gente humilde que tuvieron que ir al congreso por su capricho hayan terminado contagiados;0
Mi presidente eterno tiene mas investigaciones que la vacuna del Covid 19;0
Mientras Cuba ha enviado medicos a 22 paises de Nuestra America para combatir la Covid 19 el gobierno de realDonaldTrump envia militares a Colombia y moviliza al ejercito para reprimir a su propio pueblo;0
Ministerio de Sanidad confirmo las cifras de las ultimas 24 horas Fallecidos ascienden a 27 133;0
ACTUALIDAD Estas son las compan ias y personas que habrian participado en el supuesto cometimiento del delito de peculado durante la emergencia sanitaria por COVID 19;0
El COVID 19 necesita medidas de bioseguridad para evitarse su contagio El MEN en cabeza de la ministra delego toda la responsabilidad a las secretarias de educacion que estan quebradas Una sentencias de muerte para docentes y padres de la 3 edad DuqueEscucheALosMaestros;0
AlertaArcsa Compan ia israeli MIGAL RESEARCH INSTITUTE alerta sobre la circulacion de una vacuna fraudulenta para prevenir el Covid 19 que utiliza su nombre y logotipo en Sudamerica n nConozca mas aqui;0
George Floyd dio positivo para COVID 19 semanas antes de morir revelo autopsia;0
MELENDEZ VS OCHOA nAmbos piden comisiones investigadoras nosotros decimos que esta bien pero seria mejor y de justicia que se investigue desde que entro el primer sol de canon petrolero a Loreto nMira el video completo Aqui n n COVID 19 n ViveIquitos;0
Luego de que se declarara la cuarentena total en la Camara de Representantes se confirmaron dos nuevos casos positivos de coronavirus SemanaNoticias n nAmpliacion;0
Preocupante cifra entrega el INSColombia para Cali Por primera vez desde que se inicio el contagio de COVID 19 alcanzamos un reporte de 8 muertos dia nEs necesario que tomemos conciencia y sobre todo precauciones La autoproteccion nuestra y de nuestros seres queridos es vital;0
Que man ana amanezcamos con mas posibilidades de la vacuna para el COVID 19 y no con un caso de corrupcion mas;0
ATENCION Autopsia revela que GeorgeFloyd dio positivo para COVID19 semanas antes de morir;0
cuales son las fuentes de financiacion y como ha sido la desercion de estudiantes generadas por el Covid 19;0
Cuando parecia que el mundo quedaba pequen o y desaparecian las fronteras aparece el terror nEl Covid 19 pone a la globalizacion contra la pared nArticulo recomendado n via primicias;0
37 agentes de transito de Cali en aislamiento por caso positivo de Covid 19 en esa institucion n;0
Que pasa con el gobierno desesperado grito de enfermera en Quibdo ante falta de insumos para el COVID 19;0
A despertarse Abdala El expresidente ha sido detenido tras encontraste en su poder un arma de fuego Entre otras evidencias en su casa se encontro decenas de cajas de mascarillas y pruebas rapidas para Covid 19;0
Coronavirus Las ciudades con mayores indices de contaminacion han presentado mas casos de COVID 19;0
El grito de auxilio de los indigenas del Amazonas para detener la mineria y el COVID 19;0
Nacionales El Distrito Metropolitano de Quito registra 3 842 casos de Covid 19 y hasta el momento 305 fallecidos La parroquia donde mas casos se registran es Chillogallo con 282 despues le sigue Guamani con 255 y BelisarioQuevedo con 253;0
Inmigrantes agricultores trabajan cada dia con el temor de infectarse y llevar el virus del COVID 19 a casa nleer mas en;0
la cual se agrava en el marco del aislamiento por Covid 19 nLa administracion presenta lineas y rutas de atencion es necesario revisar en que estamos fallando buscar mayor articulacion con las autoridades para prevenir hechos lamentables Indico ALEXAHERNANDEZC;0
la cual se agrava en el marco del aislamiento por Covid 19 nLa administracion presenta lineas y rutas de atencion es necesario revisar en que estamos fallando buscar mayor articulacion con las autoridades para prevenir hechos lamentables Indico ALEXAHERNANDEZC;0
Denuncian demora para levantar cuerpos de personas con sospecha de COVID 19 que murieron en casas de Cartagena;0
Bill Gates teme que la desinformacion disuada de vacunarse contra el COVID 19;0
LDU reporta un caso de Covid 19 nJuan Barriga medico albo confirmo la noticia sin embargo aseguro que no se trata de los jugadores ni del cuerpo tecnico No se revelo el nombre del contagiado n QuedateEnCasa;0
Se confirma que militares introdujeron COVID 19 al Guaviare contagiando ademas a comunidades indigenas lamentable que el Mindefensa no proteja la salud de las comunidades que han hecho grandes esfuerzos durante la cuarentena;0
ATENCION nComunidades campesinas del Catatumbo denuncian que miembros de FFMM no cumplen ninguna medida de bioseguridad poniendo en potencial riesgo de contagio por COVID 19 a la poblacion de esta vulnerable region;0
Alertan por acumulacion de muertos por COVID 19 en Cartagena;0
Internacionales Las comunidades indigenas de Bolivia especialmente las que estan cercanas a las regiones de Santa Cruz y Beni son las mas golpeadas por el Covid 19 en estas ya se han reportado muertos y el ascenso potencial de contagios;0
Ecuador nLos ciudadanos fueron detenidos en su vivienda en la provincia de SantaElena donde se encontraron otros 200 000 y tres autos de lujo Uno de ellos tiene orden de detencion en EstadosUnidos nMas detalles n n EmergenciaSanitaria Covid 19;0
ATENCION El gerente de la Empresa Publica Metropolitana de Agua Potable y Saneamiento de Quito Guido A tiene orden de prision preventiva por el presunto delito de peculado en la compra de insumos para enfrentar al Covid 19 n;0
Tbt Nos recuerda la precaria situacion de AlcaldiaPviejo durante decadas LA COVID 19 nos muestra que la situacion es igual o peor ernestosamperp MinSaludCol IvanDuque zabaraing leydelmontes vannyjohann lalupacienaga MagdalenaGober fuego1019fm jorgecura1070;0
Ayudanos a ayudar 24 Abuelitos nos necesitan Fundacion Hogar de Abuelitos Fe y Luz Carrera 25A 1b 13 barrio santa Isabel 5603488 3015002833 Bogota solidaridad colombia compartir abuelitos emergencia coronavirus empresas covid 19 sos compasion amor paz ayuda;0
El filantropo estadounidense y cofundador de Microsoft Bill Gates expreso este jueves su preocupacion por que la desinformacion que circula en internet sobre una eventual vacuna contra la COVID 19 disuada en el futuro a la gente de inmunizarse;0
FelipeArias71 Educacionbogota Mineducacion Es un atropello por parte de un colegio cobrar clausula de permanencia y mas en emergencia de Covid 19 lospinoscolegio;0
NoticiaCali 37 agentes de Movilidad Cali se encuentran aislados dado que uno de ellos resulto contagiado por COVID 19 ejerciendo sus labores diarias n nEl secretario de Movilidad William Vallejo se refiere al caso;0
Hechos El sindicato de educadores de Santander informo que no cuentan con garantias ni protocolos para poder tener estudiantes en las aulas n n Solicitan disposicion de pruebas Covid 19 para el estudiantado docentes y resto de personal que se reintegrara alrededor de ellos;0
La pandemia por Covid 19 es el espejo de un modelo que hace agua n nPatricia Rendon y Belen Pardo hacen una lectura critica de medidas decisiones y situaciones relacionadas bajo la premisa de que el problema no es el virus sino el sistema n n;0
NoMasImpunidad PaolaPabonC la prefecta de Pichincha Paola Pabon compra 10 000 pruebas rapidas para COVID 19 para la Prefectura de Pichincha y es investigada por peculado TvSatelitalFHD andrespaezec StudioFutbol JohnTown lahoraecuador;0
George Floyd el ciudadano afroamericano que murio asfixiado por un policia en Mineapolis EE UU dio positivo por COVID 19 casi dos meses antes de su deceso;0
Leer estos testimonios es estremecedor con el tiempo nos hemos dado cuenta a lo que realmente nos enfrentamos COVID 19;0
Que tal la bellezas de fecode Quejandose dizque por la sobrecarga laboral cuando los vagos todo el an o escolar andan promoviendo paros para no trabajar El colmo FecodeIrresponsable por promover protestas en medio de la pandemia del Covid 19;0
COVID19 un gran riesgo para comunidades indigenas de la Amazonia de Bolivia;0
La academia debe criticar toda nuestras de fraude academico n nLa barra libre en revistas es un problema para la ciencia n Existe pugna en la industria n Cuidado que el Big Pharma no tiene limites n nAnte las dudas investigacion n rhidalgott camilo felix n n;0
Es que hay que tener en cuenta que NO hay vacuna ni tratamiento esto del covid 19 es bastante complicado;0
El covid 19 pasa factura a la economia ecuatoriana decrecera entre 7 3 y 9 6 en 2020;0
saludhernandezm Hablando la mama de COVID 19 verguenza que esta vieja malparida viva en Colombia;0
NoticiasCaracol Para eso necesitamos un covid pero no 19 sino recargado para acabar con media poblacion mundial;0
Medico de Liga confirmo un caso positivo de Covid 19 en los albos;0
Ministro de Salud denuncia manejo irregular en algunas UIC en medio de la pandemia por el coronavirus;0
Para algunas personas les es facil pensar que Covid 19 es una farsa una conspiracion o cualquier otra cosa nPareciera que el tener cerca de 400 000 muertes no es relevante n nMIREN MEXICO BRASIL o USA n nEn una semana se disparan los Contagios en USA por las Protestas;0
Coronavirus La situacion de la pandemia en Brasil es critica y Jair Bolsonaro sigue restandole importancia al COVID 19;0
Trabajadores se toman a esta hora Corabastos protestan por el cierre de bodegas que ordeno la Alcaldia de Bogota por la emergencia de COVID 19 gt gt;0
ante el desabastecimiento de medicina antirretroviral y la falta de atencion en el sistema de salud publica antes y durante la pandemia de Covid 19;0
pvirtualcom Situacion del Covid 19 en Popayan por comunas El norte preocupa;0
Ecuador nEn el domicilio de abdalabucaram se encontraron mas de 7 000 insumos medicos que coinciden con los investigados por peculado en el Hospital Teodoro Maldonado Carbo nMas detalles n n Corrupcion EmergenciaSanitaria Salud Covid 19 Coronavirus;0
5 707 defunciones y 40 966 casos confirmados de COVID19;0
La FiscaliaEcuador con DianaSalazarM2 a la cabeza es la peor verguenza del pais nMascarillas 5000 10000 nPruebas Covid 2000 20000 total 30000 estan locos por ganar aceptacion para Lenin que sacan cualquier Show estupido n Covid 19 3Junio n ElPeorGobiernoDeLaHistoria;0
El pueblo indigena Salasaka Provincia de Tungurahua reporta aumentos de contagios y muertes por COVID 19 Desde el 3 de junio 2020 se encuentran en toque de queda El Estado no ha tomado acciones para solucionar esta problematica n n;0
En Neiva murio un sacerdote de causa diferente a Covid 19 el centro medico estaba empen ado en hacer pasar su muerte por esta causa He escuchado historias similares en otras regiones del pais n n Se volvio negocio el Covid 19 hay alguna remuneracion por esta causa de muerte;0
Dicen que los congresistas no sesionaran presencialmente por temor al contagio del Covid 19 pero si estan impregnados de uribismo que es la peor pandemia de Colombia;0
La corrupcion esta presente todo el tiempo en el pais No dejemos que la emergencia por el Covid 19 nos distraiga PandemiaSinDistraccion;0
Sabiamos que el Covid 19 generaba dificultades respiratorias pero no sabiamos que el virus era la policia;0
LoUltimo Ponen en cuarentena el salon eliptico del Congreso tras confirmarse el primer congresista contagiado con coronavirus Durante 15 no se realizaran plenarias solo se desarrollaran comisiones virtuales;0
Segun una investigacion del gobierno surcoreano el farmaco es clinicamente significativo para reducir el tiempo de recuperacion de los pacientes contagiados;0
Rechazada una cuarta querella contra Fernando Simon por su gestion del COVID 19 a traves de laSextaTV Los papanatas de Vox;0
Mientras se va cambiando de semaforo a en varios cantones de aun no contamos con cifras oficiales reales sobre cuantos casos Covid 19 hay Cuantas disponibles en terapia intensiva tenemos Cuantos han fallecido x complicaciones relativas a Solo nos queda protegernos;0
vanguardiacom Volvemos a nadar Ahh que bien y que siga el Covid 19;0
URGENTE Pichincha es la provincia donde mas casos y muertes por Covid 19 se confirmaron en la ultima semana 540 casos y 60 fallecidos Con estas cifras se inicia hoy el SemaforoAmarilloEnQuito n eluniversocom n nLos datos de todas las provincias aqui n;0
Los paises de America registraron mas de la mitad de los nuevos casos de Covid 19 del mundo en la ultima semana;0
DEPORTES Entre las locuras de Juan Cazares del Atletico Mineiro esta irse de fiesta y contagiarse del covid 19;0
La secretaria de Salud de Palmira confirma el quinto fallecido por COVID 19 en nuestra ciudad;0
ONU la vacuna contra el Covid 19 debe ser considerada BIEN PUBLICO mundial n nA las farmaceuticas y los libertarios no les gusta esto n n Trump rompera tambien con la ONU por comunista;0
Ya hoy lo dijo el Ministro de Salud Suenan muchas piedras en el rio Veo venir el Cartel del COVID 19 Ay Colombia;0
MinutoaMinuto de CafeLaPosta junto a lorohomero n n Si se llama a un laboratorio en Quito una prueba PCR de Covid 19 cuesta unos 160 nosotros compramos las pruebas a 25 si dicen que hay sobreprecio pues que se investigue;0
Jorge Wated sobre prestamos hipotecarios No queremos llenarnos de casas;0
La rebelion de los adultos mayores colombianos contra el encierro por covid 19;0
FNAraujoR Por ser el Covid 19 un caso de Salud Publica le corresponde a MinSaludCol asumir directamente la Gerencia del Sistema de Vigilancia en Salud Publica de esta Cartagena conforme al Art 215 de la CP porque esta claro que al alcalde daulaw se les salio el asunto de las manos;0
WQNoticias Iran registro 3 574 casos de contagio de covid 19 en las ultimas 24 horas un record de casos confirmados diarios declaro el jueves el portavoz del ministerio de Salud irani Kianoush Jahanpour n;0
ATENCION nDenuncian demoras al recogimiento de posibles fallecidos a causa del covid 19 en cartagena;0
El manejo de la informacion del COVID 19 en el Ecuador deja mucho q desear nNo liberar los datos bajo la excusa de q tienen informacion identificable nBasta con eliminar la IPS de la BD publica y an adir una clave unica para luego hacer cruces entre la BD publica y la original;0
La cuarentena desatada en todo el mundo por la COVID19 le ha permitido demostrar a la ganaderia que no es la actividad que mas contamina en el mundo y por el contrario las emisiones siguen bajando ContGanadero n nAqui le explicamos por que n;0
ALERTA Nueva via petrolera abierta en Parque Nacional Yasuni durante la pandemia arriesga a pueblos en aislamiento voluntario y en reciente contacto n nEsta nueva carretera ha provocado 2 2 km de penetracion en la selva amazonica n nTexto completo;0
En abril el desempleo en el mundo aumento vertiginosamente por el confinamiento consecuente de la pandemia de la covid 19 El mundo se enfrenta a la peor crisis economica desde la Segunda Guerra Mundial;0
COVID 19 avanza en America entre alarmante alza de casos y conflictos entre EE UU y China nINFORME n;0
Policias de Quininde exhortan sobre el COVID19 bailando con un ataud al estilo africano;0
A traves de un boletin epidemiologico emitido por el DADIS el barrio Olaya Herrera actualmente es el que reporta mas casos de COVID 19 con un total de 325 Le sigue El Pozon quien siempre se ha mantenido como uno de los lugares con mas contagiados de la ciudad;0
Ya podemos salir libremente n Por que Quien dijo n El covid 19 se suicido n Como De que hablas n En las noticias dijeron que n SE DISPARO n;0
Actualidad Radiografia del reclutamiento de menores en medio del COVID 19 en Colombia gt gt;0
GeorgeFloyd tuvo coronavirus semanas antes de morir Mira todo lo que revelo la autopsia;0
Quito I Cinco parroquias registran mas de 200 casos de coronavirus Aqui el listado;0
URGENTE Confirman dos nuevos casos de COVID 19 en la Camara de Representantes CamaraColombia;0
JAJAJAJAJAJAJAJJAA 30 MILLONES DE PESOS POR DIAGNOSTICAR COVID 19 JAJAJAJAJAJAJA nEl estado se va a quebrar Multiplicar eso por 39 mil casos da casi 1 2 billones de pesos a los que hay que sumar el tratamiento de los pacientes nJAJAJAJAJAJAJA LA GENTE SI SE INVENTA MARICADAS;0
Cronica del miedo y la incertidumbre Mas alla del Covid 19 via PortalOtraVoz por nicolayduque;0
ATENCION COVID19 en Ecuador esta bajo control pero no hay que bajar la guardia Revise cuales son las cifras actuales;0
declararon semaforo amarillo Daule es uno de los cantones que vive un repunte de casos positivos por COVID 19 n Ahora ciudades como Quito estan en semaforo amarillo y circula gente por todos lados como si todo hubiera regresado a la normalidad;0
Documento Aspectos clave para la prevencion del VIH e ITS en la desescalada del confinamiento por COVID 19 Espan a indica entre otros aspectos n las relaciones nsexuales puede ser de riesgo ntanto para el SARS CoV 2 n;0
Hay decenas de charlatanes regalando Aspirina Azitromicina Hidroxicloroquina y soluciones de dioxido de cloro para que la gente se cure de la COVID 19 n Los cantones no cumplian con los lineamientos de la OMS para relajar la cuarentena y aun asi;0
WaoResistencia exigen al Gobierno Nacional su proteccion ante la COVID 19 y sen alan que hace 1 an o luchamos por proteger la selva nuestro hogar y el pulmon de TODO el mundo existimos y el Estado debe protegernos ResistenciaWaorani nMas noticias;0
Con 410 719 muestras COVID 19 procesadas 8 440 Xmillon y un subregistro de varios dias en los primeros 7 dias de junio en Colombia han crecido los contagios 28 67 y las muertes han aumentado 29 92;0
Entre el 1 y el 31 de mayo 2020 los casos positivos COVID 19 en Colombia crecieron 319 39 y las muertes crecieron 199 n nEntonces IvanDuque MinSaludCol NO han aplanado la curva y su reactivacion NO es inteligente;0
Acabo de leer recien 2 tuits indicando de 3 personas que han fallecido hoy por el Covid 19 quien miente;0
Indigenas le exigen al gobierno proteccion efectiva contra COVID 19 enemigo que los puede extinguir;0
Es mas contagioso el egoismo que el propio Covid 19 y para eso creanme que no hay vacuna;0
LoUltimo De acuerdo con la Secretaria Distrital de Salud SectorSalud el General Sandua fallecio este sabado por Covid 19 En kienyke recordamos al caldense que recorrio las calles bogotanas con su particular vestimenta y oratoria historica;0
Una amarga sorpresa para algunos y un indicio de sospecha para otros fue la noticia del pasado 1 de junio La misma institucion confirmo un nuevo brote del virus al interior de la carcel al reportar cuatro nuevos en este caso transportado por un recluso;0
Preocupante Muy preocupante hilo estadistico sobre la situacion del Covid 19 en el Ecuador nPero aqui organizan saludos cumplean eros en oficinas publicas o van al parque a hacer deporte como si nada nLean por favor;0
fecode El Covid 19 estara en el planeta por 2 o 3 an os hay que aprender a vivir con eso pero esconderse no trae resultados si no hay acciones medio ambientales en muchos paises no hubo confinamiento y su control fue mas efectivo;0
lahistoriaec ucsg tv Cinica Sinverguenza monserratcream1 con los chicos en clases virtuales presionando a Vinicio Baquero q firme contrato x 10 millones para desayuno escolar Educacion Ec n nEn Quito exigio a maestros ir a repartir kits exponiendolos al Covid 19 ademas eres una criminal CREAMER;0
LoUltimo De acuerdo con la Secretaria Distrital de Salud SectorSalud el General Sandua fallecio este sabado por Covid 19 En kienyke recordamos al caldense que recorrio las calles bogotanas con su particular vestimenta y oratoria historica;0
