tw;puntuacion
PORTOVIEJO Operativo de control de ventas de insumos medicos y pruebas rapidas para Covid 19 como resultado se decomiso 600 mascarillas tipo N 95 y 100 pruebas rapidas del covid19 en distribuidora que no contaba con los permisos lumicha16 C N ARCSA CZ4 PoliciaEcuador;0
Juan Cazares dio positivo para Covid 19 n nMira la Info QuedateEnCasa AtleticoMineiro Brasil;0
COMUNICADO n n CONMEBOL ha determinado que el proceso de licencia de clubes en el futbol femenino para la participacion de la Copa Libertadores Femenina 2020 se encuentra suspendido debido a los impactos por la pandemia del Covid 19 n n PateamosFuerte;0
A continuacion grafica de casos diarios diagnosticados con covid 19 vs muertes diarias a causa del covid 19 en Colombia n;0
fecode Fecode dejen de darse la importancia que ya no tienen Colombia sera el pais con la cuarentena mas larga ademas oigan los adelantos cientificos una cuarentena como la de Colombia no era necesaria el COVID 19 se podia controlar de otras formas;0
EmergenciasEc 10 enfermos de Covid 19 entre mis conocidos 6 de ellos ya lo tuvieron y han recaido;0
Colombia CoronavirusEnColombia Bogota Atlantico y el Valle del Cauca son las zonas con mas casos a nivel nacional;0
Radiografia de tres brotes coVID 19 asi se contagiaron y asi podemos evitarlo nUna oficina un restaurante y un autobus Tres contagios multiples estudiados minuciosamente por las autoridades sanitarias ofrecen valiosas lecciones para la desescalada n;0
CoberturaCorona Cuando llegaron los conquistadores murieron millones de indigenas por enfermedades Hoy en dia los paralelos con el pasado son preocupantes n n ResistenciaWaorani n nEnterate de toda la investigacion aqui n n n nFoto WaoResistencia;0
Covid 19 En el Ecuador hasta la man ana del 7 de junio se registran n n 11 954 personas con alta epidemiologica n 4 250 personas recuperadas n 4 977 casos con alta hospitalaria n 43 120 casos confirmados n 57 828 casos descartados n 3 621 fallecidos confirmados con COVID 19;0
Un reo que fue trasladado por neumonia a un hospital desde la carcel El Turi en la andina Cuenca dio positivo por covid 19 y tras recibir atencion medica adecuada en cuidados intensivos sin embargo este 6 de junio los galenos confirmaron su deceso;0
Y a todas estas donde anda el super gerente del covid 19 el dr Plata nNo creo que camelle detras de bambalinas;0
No solo los departamentos apartados funcionaban pesimo Caldas Santander y Magdalena no tenian capacidad para caminar solos y debieron acordar con sus universidades acuerdos para trabajar la covid 19 saludhernandezm OpinionSemana;0
Departamentos que al inicio de esta emergencia ocupaban primeros lugares en ranking de Covid 19 como Magdalena y C marca han reducido esos indicadores lo cual hay que destacar n nAterrador lo que ocurre en el ValleDelCauca solo en Cali hoy se registraron 10 fallecimientos;0
5 implicaciones de ciberseguridad del COVID 19 a largo plazo MSFTColombia Microsoft QuedateEnCasa Ciberseguridad ConfianzaCero SAFE;0
ATENCION El numero de fallecidos por coronavirus ascendio a 3 621 en Ecuador donde la cifra de contagios confirmados totaliza 42 728 es decir 392 casos en las ultimas 24 horas n n 2 437 fallecidos probables por COVID 19 n En Tungurahua 77 muertos y 609 contagios;0
Este grupo etnico del Ecuador habitado por aproximadamente 3 mil habitantes en las provincias de Pastaza Napo y Orellana se sienten afectados en las diversas comunidades y piden a la autoridades el ser tomados en cuenta tras los casos de COVID 19 confirmados;0
Internos de la carcel de Tumaco contagiados con COVID 19 via caracolradio;0
NACIONAL La Cancilleria ecuatoriana informo que abrira un expediente sancionador para un funcionario de la Embajada en Espan a que esta involucrado en una fiesta que rompio el confinamiento el covid 19 en ese pais n nDetalles n;0
Oficialmente he ingresado la denuncia a Contraloria x posibles irregularidades en compra d insumos medicos por Covid 19 n Bomberos Guayaquil Esto s algo q debe acabar Por favor FiscaliaEcuador tomar las acciones correspondientes VillaFernando fabriciovelav anniecanizares;0
El Covid 19 le ha quitado la vida a mas de 400 000 personas en todo el mundo;0
PROTOCOLO DE ATENCION Y DE DESTINO DE RESTOS MORTALES POR POSIBLE COVID 19 NO ES MAS;0
COVID 19 no paro exportaciones pero afecto crecimiento en Ecuador;0
navarrowolff Definitivamente la izquierda es un virus peor que el COVID 19 nAl COVID 19 se controla con aislamiento y bioseguridad pero la izquierda populista no se controla ni se satisface con nada son obstaculo nocivo para reactivar la economia y el auto cuidado para evitar el contagio;0
Contraloria Municipal de Palmira denuncio 21 hallazgos administrativos tras una auditoria especial del PAE en Palmira Valle suscritos luego de la declaratoria de emergencia por el Covid 19 Infortunadamente los casos asi abundan en el pais n;0
Atencion Reportan siete casos mas de COVID 19 en El Espinal Ibague Libano Mariquita y Fresno n nMas detalles;0
el forastero1 MinSaludCol Pero no es asi todo quien llegue con fiebre lo meten por covid 19 me lo dicen mis hermanos que trabajan en un hospital;0
Movilidad Humana Los migrantes son los mas expuestos al contagio del Covid 19 Todos tenemos derecho a la salud sin importar nuestra condicion HumanidadParaTodos Conoce mas IFRC es eu echo;0
Nadie n nFamiliares de pacientes en IMAT Destruyen propiedad privada por el estres que genera tener un familiar fallecido que deba ser cremado por presuncion de Covid 19 n nDireccion de IMAT Nada no hay vacantes para psicologos todavia no los necesitamos n nYo Ah bueno dale;0
Rufianes del ELN asesinan a 2 heroes en Arauca man ana habran protestas en repudio Perdon se me olvidaba que no son lideres de izquierda n n IvanDuque Colombia tiene otros virus peores que el covid 19 ojala se declare estado de excepcion para combatirlos El Patriota;0
Dictaduras democraticas autoritarismo neoliberal y revueltas populares en tiempos de Covid 19 CELAG;0
Denuncian negligencia en traslado de alcaldesa de Iscuande por sospecha de COVID 19 VocesySonidos;0
Por fin petrogustavo reconoce ser uno de los ricos que tanto desprecia Dice q el Covid 19 lo trajeron los ricos en avion y se propago en Transmilenio Cuantos aviones uso para sus 2 viajes a Cuba Cuantos pobres viajan al exterior para una prueba medica;0
Este peligro sigue y no es tan latente ravilapinto ACHC Oficial Por meses habra que tener camas disponibles para pacientes con Covid 19 tienen el costo pero no el ingreso;0
El nuevo total de casos confirmados por MinSalud de Covid19 en Colombia es de 39 236 y 1 259 muertes A nivel mundial ya se han registrado mas de 400 mil fallecidos por esta causa Mas aqui n;0
A veces quisiera creer que se puede trabajar con gente de la oposicion en pro de buscar soluciones a esta situacion por causa del Covid 19 pero me acuerdo que hay personajes como Gustavo Bolivar y se me pasa la idea;0
Se informa a la comunidad que el COVID 19 cobro la vida de otra persona en Santander una mujer de 87 an os en Barrancabermeja n nIncluyendo a esta persona fallecida son 19 los casos reportados hoy en Barrancabermeja Bucaramanga Giron Lebrija y Piedecuesta;0
Profesionales de la salud se reunen en Barranquilla para rendir homenaje al anestesiologo que fallecio por COVID 19;0
Excepto por tres alcaldes no escucho a nadie mas hablando de su estrategia para enfrentar la reactivacion economica y recuperacion del empleo post covid 19 definitivamente estamos jodidos si los GADS no se ponen al frente de la recuperacion de sus territorios quien entonces;0
Covid 19 podria propagarse aun mas en EEUU por protestas en Minneapolis;0
Chile supera las 2 000 muertes por covid 19 al reconocer 653 fallecidos adicionales;0
Otavalo es el canton que registro el incremento de contagios mas importante Aqui los detalles;0
Mundo Ya se supero la barrera de los 7 millones de personas en el mundo que estan han estado contagiadas por COVID 19 de las cuales mas de 3 millones se han recuperado y alrededor de 400 mil han perdido la vida a causa del virus ReporteCOVID19;0
La cifra de contagiados por Covid 19 en Ecuador supero los 43 000 este domingo;0
Dos nuevos casos por Covid 19 se reportaron hoy en Neiva n;0
Alerta en America Latina por COVID 19 el pico de la epidemia no llega y ni siquiera esta a la vista;0
Paciente de 21 an os sufre fractura tipo C en vertebra T9 se realiza estabilizacion minimamente invasiva con recuperacion del alineamiento y cifosis adecuada covid 19 spine trauma pablopenatapia;0
Ahora salimos debiendo despues de arriesgarlo todo Rechazo Covid 19 ministeriosalud IvanDuque AMCI Colombia Fruizgomez;0
marcoveloz1973 cscgye PoliciaEcuador Esto es del Guyaquil que esta en otra dimension en el que dicen que ya no hay muertos por Covid 19;0
Un paciente hospitalizado fallecio el lunes de COVID 19 Usted debe estar refiriendo a otro Guayaquil de otra dimension como Lenin habla de otro Ecuador que esta en su mente;0
